{
  "actor": {
    "class": "chatgpt",
    "instance": "GPT-5.6 Sol",
    "session_ref": "sv-cost-eleven-lane-provider-secret-regression-guard-2026-09-02"
  },
  "base_commit": "aea0fe5d82f0924ed630a22e9dd1c728b1dfb65f",
  "change_id": "SV-CONT-20260902-PROVIDER-SECRET-GUARD-017",
  "changed_paths": [
    {
      "change_type": "modified",
      "hash": "6b95aac371c21872303583bb5d273987ade9af37",
      "hash_algorithm": "git-blob-sha1",
      "path": ".continuity/config.json"
    },
    {
      "change_type": "added",
      "hash": "8902d1ae4e7e1093088d025670c84cb00e30510a",
      "hash_algorithm": "git-blob-sha1",
      "path": ".github/workflows/provider-secret-boundary-validation.yml"
    },
    {
      "change_type": "modified",
      "hash": "f47b80fb115f1020744ce3777a45fbb32dd2910d",
      "hash_algorithm": "git-blob-sha1",
      "path": "docs/WORKFLOWS_SECURITY_MIRROR_HANDOFF.md"
    },
    {
      "change_type": "added",
      "hash": "da775319a5d391134ce3f2877541a235ebf4e455",
      "hash_algorithm": "git-blob-sha1",
      "path": "tests/test_provider_secret_boundary.py"
    },
    {
      "change_type": "added",
      "hash": "385784346f456f70f755c30be95a5bd929c3fb57",
      "hash_algorithm": "git-blob-sha1",
      "path": "tools/verify_no_direct_provider_secrets.py"
    }
  ],
  "claims": [
    {
      "claim": "active consumer workflows remain free of direct provider-secret interpolation or provider-key runtime references",
      "state": "MACHINE_CHECKED"
    },
    {
      "claim": "provider-secret boundary validation is non-authorizing and uses empty GitHub permissions with a pinned checkout action",
      "state": "DECLARED"
    },
    {
      "claim": "credentialless eleven-lane cost acquisition remains independent of API-key provisioning",
      "state": "PRESERVED"
    }
  ],
  "created_at": "2026-09-02T20:47:00-05:00",
  "governing_handoff": {
    "hash": "9a6ebc5e5331fe79c2aa7551279ddb285868cf69",
    "hash_algorithm": "git-blob-sha1",
    "path": "docs/WORKFLOWS_MIRROR_HANDOFF.md"
  },
  "repository": "GCAT-BCAT-Engine/workflows",
  "schema": "stegverse.session.change_record.v1",
  "unresolved_tasks": [
    "merge provider-secret regression guard after hosted validation",
    "continue historical provider workflow provenance audit under issue #16",
    "obtain authentic credentialless provider cost observations and lane-11 sovereign runtime evidence"
  ],
  "record_hash": "1d823509ce51145c0c5cf837a20448420e456456cdc296150a2da19531bbaf42"
}
