{
  "actor": {
    "class": "chatgpt",
    "instance": "GPT-5.6 Thinking",
    "session_ref": "handoff-authority-integration-2026-08-04"
  },
  "base_commit": "893abee7b959169095af59a0051ac51cd716a68a",
  "change_id": "SV-CONT-20260804-PROVENANCE-003",
  "changed_paths": [
    {
      "change_type": "modified",
      "hash": "bfea3d9c9839b68315db7171fc283bbf0a405251",
      "hash_algorithm": "git-blob-sha1",
      "path": ".continuity/config.json"
    },
    {
      "change_type": "modified",
      "hash": "222ca40b5956f49354ae1fb82af491574c27a818",
      "hash_algorithm": "git-blob-sha1",
      "path": ".github/workflows/continuity-provenance.yml"
    },
    {
      "change_type": "modified",
      "hash": "1a4a029dd6ab95367143064e398335238bd5a9d4",
      "hash_algorithm": "git-blob-sha1",
      "path": ".handoff/current.json"
    },
    {
      "change_type": "added",
      "hash": "48501a4b1b9fa8f877ab1a6e15d75b85f823f2d3",
      "hash_algorithm": "git-blob-sha1",
      "path": "data/continuity-provenance-adoption.json"
    },
    {
      "change_type": "modified",
      "hash": "5476f957246ded2629131cdd931b84e6422df9d9",
      "hash_algorithm": "git-blob-sha1",
      "path": "docs/WORKFLOWS_MIRROR_HANDOFF.md"
    }
  ],
  "claims": [
    {
      "claim": "reviewed six-repository provenance corpus consolidated",
      "state": "IMPLEMENTED"
    },
    {
      "claim": "all six authority and provenance workflow pairs recorded as ALLOW",
      "state": "VALIDATED_HOSTED"
    },
    {
      "claim": "adoption registry deterministic hash and CI validation installed",
      "state": "IMPLEMENTED"
    }
  ],
  "created_at": "2026-08-04T23:42:00Z",
  "governing_handoff": {
    "hash": "5476f957246ded2629131cdd931b84e6422df9d9",
    "hash_algorithm": "git-blob-sha1",
    "path": "docs/WORKFLOWS_MIRROR_HANDOFF.md"
  },
  "record_hash": "9f83dcca0b5dd4349e17af60e636347eb1773a0c76791f7a887150ac5c03a4a6",
  "repository": "GCAT-BCAT-Engine/workflows",
  "schema": "stegverse.session.change_record.v1",
  "unresolved_tasks": [
    "observe successor record 003 authority and provenance workflow results",
    "transfer validated provenance adoption registry into Master Records custody",
    "make dual-gate ALLOW a Runtime Orchestrator dispatch prerequisite"
  ]
}
