{
  "actor": {
    "class": "chatgpt",
    "instance": "GPT-5.6 Thinking",
    "session_ref": "handoff-orchestration-session-archive-closure-2026-08-05"
  },
  "base_commit": "823dd91389418377e9aa1b4c665bb09f08ad67c6",
  "change_id": "SV-CONT-20260805-PROVENANCE-009",
  "changed_paths": [
    {
      "change_type": "modified",
      "hash": "cc343ce85680287760f43d1f7ee69f4d5d1f08ee",
      "hash_algorithm": "git-blob-sha1",
      "path": ".continuity/config.json"
    },
    {
      "change_type": "modified",
      "hash": "a1130d495d01255dbf7a0759a507ec985936342b",
      "hash_algorithm": "git-blob-sha1",
      "path": ".continuity/cross-repository-references.json"
    },
    {
      "change_type": "modified",
      "hash": "e18ec90320020675272bd4050b1b94548835a918",
      "hash_algorithm": "git-blob-sha1",
      "path": ".handoff/current.json"
    },
    {
      "change_type": "modified",
      "hash": "06dcbf29b8d2aa99065f186c80e1b9e89876ee85",
      "hash_algorithm": "git-blob-sha1",
      "path": "data/session-consolidation/handoff-orchestration-session-20260804.json"
    },
    {
      "change_type": "modified",
      "hash": "f2370098a9c4bd0556def94c0bacde654f844564",
      "hash_algorithm": "git-blob-sha1",
      "path": "docs/WORKFLOWS_MIRROR_HANDOFF.md"
    }
  ],
  "claims": [
    {
      "claim": "all 11 originating-session goals are complete or merged into exact canonical workstreams",
      "state": "VALIDATED"
    },
    {
      "claim": "zero originating-session active or unassigned claims remain",
      "state": "VALIDATED"
    },
    {
      "claim": "expanded semantic custody and Runtime Orchestrator verified-state dispatch are hash-pinned required references",
      "state": "IMPLEMENTED"
    },
    {
      "claim": "adjacent decision, plane, ingress, consumer-test, and publication work remains incomplete only under its canonical owners",
      "state": "PRESERVED_BOUNDARY"
    },
    {
      "claim": "originating session state is fully durable and archive-ready",
      "state": "COMPLETE"
    }
  ],
  "created_at": "2026-08-05T02:00:00Z",
  "governing_handoff": {
    "hash": "f2370098a9c4bd0556def94c0bacde654f844564",
    "hash_algorithm": "git-blob-sha1",
    "path": "docs/WORKFLOWS_MIRROR_HANDOFF.md"
  },
  "repository": "GCAT-BCAT-Engine/workflows",
  "schema": "stegverse.session.change_record.v1",
  "unresolved_tasks": [
    "none for the originating session",
    "repository-native owners continue DECISION-001, PLANE-001, INGRESS-001, TEST-001, and PROP-001 from the execution inventory"
  ],
  "record_hash": "7609515730dae1d54767cbd608ce7a90cf907f5a657fcc6c80ca9fcb9dff4792"
}
