{
  "actor": {
    "class": "chatgpt",
    "instance": "GPT-5.6 Sol",
    "session_ref": "sv-cost-eleven-lane-glm53-resident-intake-2026-09-02"
  },
  "base_commit": "05bc42264684806f930943af216d4781e9797000",
  "change_id": "SV-CONT-20260902-GLM53-INTAKE-015",
  "changed_paths": [
    {
      "change_type": "modified",
      "hash": "8d84cba597a0ae4c42a8f04004dc4c6f85b68a8c",
      "hash_algorithm": "git-blob-sha1",
      "path": ".continuity/config.json"
    },
    {
      "change_type": "modified",
      "hash": "7921f2145757850029b0a0b3b1880dd8bd1677ad",
      "hash_algorithm": "git-blob-sha1",
      "path": ".handoff/current.json"
    }
  ],
  "claims": [
    {
      "claim": "repository-wide handoff authority remains docs/WORKFLOWS_MIRROR_HANDOFF.md",
      "state": "PRESERVED"
    },
    {
      "claim": "existing current-named program/security handoffs are subordinate scoped handoffs rather than competing repository-wide authority",
      "state": "DECLARED"
    },
    {
      "claim": "SV-cost program paths remain continuity-exempt program artifacts while manifest changes are provenance-bound",
      "state": "PRESERVED"
    },
    {
      "claim": "GLM sovereign resident evidence intake grants no runtime, credential, provider, publication, or release authority",
      "state": "PRESERVED"
    }
  ],
  "created_at": "2026-09-02T18:31:00-05:00",
  "governing_handoff": {
    "hash": "9a6ebc5e5331fe79c2aa7551279ddb285868cf69",
    "hash_algorithm": "git-blob-sha1",
    "path": "docs/WORKFLOWS_MIRROR_HANDOFF.md"
  },
  "repository": "GCAT-BCAT-Engine/workflows",
  "schema": "stegverse.session.change_record.v1",
  "unresolved_tasks": [
    "merge validated resident GLM sovereign evidence intake source under issue #26",
    "await authentic resident lane-11 evidence before installing runtime-evidence/glm-sovereign.json"
  ],
  "record_hash": "8176e6204c9d35c1f43fda0baaf99910597bfdfacc4d6e6bf14ba6ec53f5f960"
}
